1,non mi integer,nascetur ridiculus mus vivamus vestibulum sagittis
2,porta volutpat,sit amet diam in magna
3,sociis natoque penatibus,faucibus cursus urna ut tellus nulla ut
4,rhoncus sed vestibulum,diam in magna bibendum imperdiet nullam orci
5,parturient montes nascetur,pharetra magna vestibulum aliquet ultrices erat tortor
6,in faucibus orci,mauris enim leo rhoncus sed
7,rhoncus sed vestibulum,lectus pellentesque at nulla suspendisse
8,sapien non mi,quam sapien varius ut blandit non interdum
9,cum sociis natoque,turpis integer aliquet massa id lobortis
10,nonummy integer,ut dolor morbi vel lectus in
11,in hac habitasse,quis tortor id nulla ultrices
12,vel enim,velit donec diam neque vestibulum
13,est et,eros suspendisse accumsan tortor quis turpis
14,dui maecenas,tempus vel pede morbi porttitor lorem id
15,pellentesque ultrices,velit vivamus vel nulla eget eros
16,enim blandit,dignissim vestibulum vestibulum ante ipsum
17,eu magna,at nunc commodo placerat praesent blandit nam
18,curae mauris viverra,laoreet ut rhoncus aliquet pulvinar sed nisl
19,eros suspendisse accumsan,nulla nunc purus phasellus in felis donec
20,bibendum morbi,vulputate elementum nullam varius nulla facilisi cras
21,lorem ipsum,dolor quis odio consequat varius integer ac
22,morbi vestibulum,elementum eu interdum eu tincidunt
23,ornare consequat lectus,tellus nisi eu orci mauris
24,vel sem sed,bibendum morbi non quam nec
25,rutrum nulla tellus,morbi sem mauris laoreet ut rhoncus aliquet
